{
  "version": 1,
  "intent_id": "intent_002",
  "execution_id": "exec_002",
  "tenant_id": "tenant_xyz",
  "action_type": "ADMIN_CHANGE",
  "rail": {
    "type": "INTERNAL_ADMIN",
    "network": "internal",
    "chain_id": null,
    "contract": null
  },
  "actor": {
    "caller": "user_789",
    "role": null
  },
  "target": {
    "to": "policy_critical",
    "asset": "CONFIG",
    "asset_class": null,
    "amount": "0",
    "decimals": 0
  },
  "constraints": {
    "ttl": 1772000000,
    "nonce": 1,
    "replay_scope": "tenant"
  },
  "policy_binding": {
    "policy_id": "policy_admin",
    "policy_version": 3,
    "policy_hash": "0xdef456"
  },
  "metadata": {
    "created_at": 1771999900,
    "reason": "threshold update"
  }
}
